{
  "schema_version": "1.0",
  "report_kind": "font-environment",
  "status": "need-user",
  "platform": "unverified",
  "wsl": false,
  "external_reads": {"approval_state": "required", "requested_paths": [], "observed_paths": []},
  "environments": {
    "build": {"status": "unverified", "renderer": "unresolved", "visible_fonts": [], "registered_fonts": [], "mounted_font_files": [], "observed_substitutions": [], "evidence": []},
    "render": {"status": "unverified", "renderer": "unresolved", "visible_fonts": [], "registered_fonts": [], "mounted_font_files": [], "observed_substitutions": [], "evidence": []},
    "target": {"status": "unverified", "renderer": "unresolved", "visible_fonts": [], "registered_fonts": [], "mounted_font_files": [], "observed_substitutions": [], "evidence": []}
  }
}
